{
  "schema_version": 1,
  "generated_at": "2025-04-02T12:00:00Z",
  "conventions": {
    "inception_date": "2025-01-01",
    "return_currency": "USD",
    "benchmark": {
      "name": "Nasdaq-100",
      "series_identifier": "SYNTHETIC-TEST-PRICE",
      "return_basis": "price_return"
    },
    "strategy_return_basis": {
      "basis": "net",
      "methodology_id": "synthetic-test-only",
      "public_description": "Net of synthetic transaction costs for validator tests."
    },
    "audit_status": "unaudited",
    "period_convention": "official_calendar_month_close",
    "drawdown_convention": "month_end_series"
  },
  "performance": [
    {
      "period": "2025-01",
      "as_of_date": "2025-01-31",
      "revision": 1,
      "strategy_return_pct": "2.000000",
      "benchmark_return_pct": "1.000000"
    },
    {
      "period": "2025-02",
      "as_of_date": "2025-02-28",
      "revision": 1,
      "strategy_return_pct": "-1.000000",
      "benchmark_return_pct": "2.000000"
    },
    {
      "period": "2025-03",
      "as_of_date": "2025-03-31",
      "revision": 1,
      "strategy_return_pct": "3.000000",
      "benchmark_return_pct": "-1.000000"
    }
  ],
  "releases": [
    {
      "period": "2025-03",
      "revision": 1,
      "composition": [
        {
          "sleeve_id": "physical-scarcity",
          "weight_pct_nav": "20.000000"
        },
        {
          "sleeve_id": "compute-platforms",
          "weight_pct_nav": "20.000000"
        },
        {
          "sleeve_id": "survivors-tolls-second-wave",
          "weight_pct_nav": "20.000000"
        },
        {
          "sleeve_id": "moonshots",
          "weight_pct_nav": "5.000000"
        },
        {
          "sleeve_id": "macro-scenario-bets",
          "weight_pct_nav": "15.000000"
        },
        {
          "sleeve_id": "reserve-optionality",
          "weight_pct_nav": "20.000000"
        }
      ],
      "holdings": [
        {
          "name": "Example Compute Company",
          "sleeve_id": "compute-platforms",
          "weight_pct_nav": "5.000000"
        },
        {
          "name": "Example Grid Company",
          "sleeve_id": "physical-scarcity",
          "weight_pct_nav": "4.000000"
        }
      ],
      "attribution": {
        "level": "sleeve",
        "coverage": "complete",
        "items": [
          {
            "sleeve_id": "physical-scarcity",
            "effect_pp": "1.000000"
          },
          {
            "sleeve_id": "compute-platforms",
            "effect_pp": "0.500000"
          },
          {
            "sleeve_id": "survivors-tolls-second-wave",
            "effect_pp": "0.500000"
          },
          {
            "sleeve_id": "moonshots",
            "effect_pp": "0.000000"
          },
          {
            "sleeve_id": "macro-scenario-bets",
            "effect_pp": "0.500000"
          },
          {
            "sleeve_id": "reserve-optionality",
            "effect_pp": "0.500000"
          }
        ]
      },
      "commentary": {
        "paragraphs": [
          "Synthetic validator fixture only."
        ]
      }
    }
  ],
  "corrections": []
}
